{
  "schemaVersion": 1,
  "bundleId": "golden-path",
  "contentVersion": "0.1.0",
  "generatedAt": "2026-06-27T00:00:00Z",
  "concepts": [
    {
      "id": "responsive-desire",
      "name": "Responsive Desire",
      "category": "timing",
      "definition": "Sexual interest that arises in response to stimulation or erotic context, rather than appearing spontaneously beforehand.",
      "summary": "Desire can arrive after touch, context, or connection begins. That pattern is common and valid.",
      "blocks": [
        {
          "id": "responsive-desire-recognize",
          "type": "recognize",
          "title": "Recognize",
          "body": "Do you rarely feel random urges for sex, but once things start, you get into it and enjoy yourself?"
        },
        {
          "id": "responsive-desire-mechanism",
          "type": "mechanism",
          "title": "Understand",
          "body": "Desire research describes responsive desire as a common, healthy pattern, especially for women and in long-term relationships. Lack of spontaneous urge beforehand does not mean low libido; many people become interested once touch, mood, or connection engages them.",
          "citationIds": [
            "basson-2000",
            "nagoski-2015"
          ]
        },
        {
          "id": "responsive-desire-reflection",
          "type": "reflection",
          "title": "Field Note",
          "body": "What conditions help you become curious after you begin: comfort, pacing, emotional closeness, type of touch, or something else?",
          "privateByDefault": true
        },
        {
          "id": "responsive-desire-phrase",
          "type": "phrase",
          "title": "A Phrase To Keep",
          "body": "I do not always feel desire before we begin, but sometimes it shows up once there is warmth, touch, and no pressure."
        }
      ],
      "relatedConceptIds": [
        "non-concordance",
        "spectatoring"
      ],
      "phraseTemplates": [
        {
          "id": "responsive-desire-self-understanding",
          "label": "For myself",
          "body": "I am learning that responsive desire may matter for me, and I want to notice it without turning it into a goal.",
          "tone": "soft",
          "useCase": "self-understanding"
        },
        {
          "id": "responsive-desire-partner-request",
          "label": "Ask for support",
          "body": "Can we make space for making room for responsive desire slowly, with check-ins about what feels good and what does not?",
          "tone": "direct",
          "useCase": "partner-request"
        },
        {
          "id": "responsive-desire-boundary",
          "label": "Set a boundary",
          "body": "If responsive desire starts to feel pressured or uncomfortable, I want us to pause and choose a different pace.",
          "tone": "direct",
          "useCase": "boundary"
        },
        {
          "id": "responsive-desire-curiosity",
          "label": "Open curiosity",
          "body": "I am curious about making room for responsive desire, and I would like to treat it as an experiment rather than something we have to get right.",
          "tone": "curious",
          "useCase": "curiosity"
        },
        {
          "id": "responsive-desire-reassurance",
          "label": "Reassure",
          "body": "Nothing is wrong if responsive desire shows up differently from one experience to the next. I want patience and honesty to lead.",
          "tone": "reassuring",
          "useCase": "reassurance"
        }
      ],
      "citations": [
        {
          "id": "basson-2000",
          "label": "Basson circular model of desire",
          "source": "Basson, 2000"
        },
        {
          "id": "nagoski-2015",
          "label": "Responsive desire synthesis",
          "source": "Nagoski, 2015"
        }
      ],
      "mediaIds": [
        "responsive-desire-video"
      ],
      "reviewStatus": "approved"
    },
    {
      "id": "angling",
      "name": "Angling",
      "category": "technique",
      "definition": "Rotating, raising, or lowering the pelvis during penetration to adjust where internal stimulation occurs.",
      "summary": "Small changes in pelvic angle can redirect pressure and make a familiar position feel different.",
      "blocks": [
        {
          "id": "angling-recognize",
          "type": "recognize",
          "title": "Recognize",
          "body": "Have you ever shifted your hips during penetration to find an angle that felt better?"
        },
        {
          "id": "angling-mechanism",
          "type": "mechanism",
          "title": "Understand",
          "body": "The OMGyes Pleasure Report identified angling as a named technique associated with enhanced pleasure. Naming the movement can help you notice it in the moment and repeat what works instead of relying on a vague memory of a position.",
          "citationIds": [
            "hensel-2021"
          ]
        },
        {
          "id": "angling-reflection",
          "type": "reflection",
          "title": "Field Note",
          "body": "What angle, height, or position tends to make internal pressure feel more focused for you?",
          "privateByDefault": true
        },
        {
          "id": "angling-phrase",
          "type": "phrase",
          "title": "A Phrase To Keep",
          "body": "A small change in angle can make a big difference for me. I may want to slow down and adjust my hips until the pressure lands right."
        }
      ],
      "relatedConceptIds": [
        "pairing"
      ],
      "phraseTemplates": [
        {
          "id": "angling-self-understanding",
          "label": "For myself",
          "body": "I am learning that angling may matter for me, and I want to notice it without turning it into a goal.",
          "tone": "soft",
          "useCase": "self-understanding"
        },
        {
          "id": "angling-partner-request",
          "label": "Ask for support",
          "body": "Can we make space for exploring angling slowly, with check-ins about what feels good and what does not?",
          "tone": "direct",
          "useCase": "partner-request"
        },
        {
          "id": "angling-boundary",
          "label": "Set a boundary",
          "body": "If angling starts to feel pressured or uncomfortable, I want us to pause and choose a different pace.",
          "tone": "direct",
          "useCase": "boundary"
        },
        {
          "id": "angling-curiosity",
          "label": "Open curiosity",
          "body": "I am curious about exploring angling, and I would like to treat it as an experiment rather than something we have to get right.",
          "tone": "curious",
          "useCase": "curiosity"
        },
        {
          "id": "angling-reassurance",
          "label": "Reassure",
          "body": "Nothing is wrong if angling shows up differently from one experience to the next. I want patience and honesty to lead.",
          "tone": "reassuring",
          "useCase": "reassurance"
        }
      ],
      "citations": [
        {
          "id": "hensel-2021",
          "label": "OMGyes Pleasure Report",
          "source": "Hensel et al., 2021, PLOS ONE"
        }
      ],
      "mediaIds": [
        "angling-diagram",
        "angling-illustration"
      ],
      "reviewStatus": "approved"
    },
    {
      "id": "pairing",
      "name": "Pairing",
      "category": "technique",
      "definition": "Adding external clitoral stimulation during penetration, either solo or with a partner.",
      "summary": "Penetration and external clitoral touch can work together rather than competing for attention.",
      "blocks": [
        {
          "id": "pairing-recognize",
          "type": "recognize",
          "title": "Recognize",
          "body": "Have you found that penetration alone does not quite get you there, but adding clitoral touch changes everything?"
        },
        {
          "id": "pairing-mechanism",
          "type": "mechanism",
          "title": "Understand",
          "body": "Research consistently links clitoral stimulation with higher orgasm likelihood during partnered sex. Pairing treats external touch as common, useful information about anatomy, not as a fix for something wrong.",
          "citationIds": [
            "hensel-2021",
            "frederick-2018"
          ]
        },
        {
          "id": "pairing-reflection",
          "type": "reflection",
          "title": "Field Note",
          "body": "What kind of external touch, pressure, rhythm, or tool tends to pair well with internal sensation for you?",
          "privateByDefault": true
        },
        {
          "id": "pairing-phrase",
          "type": "phrase",
          "title": "A Phrase To Keep",
          "body": "Penetration feels better for me when it is paired with clitoral touch. I would like that to be part of the experience, not an extra."
        }
      ],
      "relatedConceptIds": [
        "angling"
      ],
      "phraseTemplates": [
        {
          "id": "pairing-self-understanding",
          "label": "For myself",
          "body": "I am learning that pairing may matter for me, and I want to notice it without turning it into a goal.",
          "tone": "soft",
          "useCase": "self-understanding"
        },
        {
          "id": "pairing-partner-request",
          "label": "Ask for support",
          "body": "Can we make space for exploring pairing slowly, with check-ins about what feels good and what does not?",
          "tone": "direct",
          "useCase": "partner-request"
        },
        {
          "id": "pairing-boundary",
          "label": "Set a boundary",
          "body": "If pairing starts to feel pressured or uncomfortable, I want us to pause and choose a different pace.",
          "tone": "direct",
          "useCase": "boundary"
        },
        {